[
  {
    "source_channel": "invoice_email",
    "event_type": "purchase",
    "counterparty": {
      "name": "David Frost",
      "company": "Modevin Timepieces LLC",
      "phone": "8604207958",
      "email": "frost.enterprises24@gmail.com"
    },
    "watch": {
      "brand": "Tudor",
      "model": "Royal 39",
      "reference": "m28500-0005",
      "condition": "BNIB",
      "set_completeness": "Full Set"
    },
    "financials": {
      "agreed_price": 2200,
      "currency": "USD",
      "payment_method": "Wire"
    },
    "workflow_status": "intake_confirmed",
    "idempotency_key": "invoice_127_w1",
    "created_at": "2026-04-08T20:03:00Z"
  },
  {
    "source_channel": "invoice_email",
    "event_type": "purchase",
    "counterparty": {
      "name": "David Frost",
      "company": "Modevin Timepieces LLC",
      "phone": "8604207958",
      "email": "frost.enterprises24@gmail.com"
    },
    "watch": {
      "brand": "Tudor",
      "model": "Royal 41",
      "reference": "m28600-0009",
      "condition": "BNIB",
      "set_completeness": "Full Set"
    },
    "financials": {
      "agreed_price": 2200,
      "currency": "USD",
      "payment_method": "Wire"
    },
    "workflow_status": "intake_confirmed",
    "idempotency_key": "invoice_127_w2",
    "created_at": "2026-04-08T20:03:00Z"
  },
  {
    "source_channel": "invoice_email",
    "event_type": "purchase",
    "counterparty": {
      "name": "David Frost",
      "company": "Modevin Timepieces LLC",
      "phone": "8604207958",
      "email": "frost.enterprises24@gmail.com"
    },
    "watch": {
      "brand": "Tudor",
      "model": "Black Bay 54",
      "reference": "m79000n-0002",
      "condition": "BNIB",
      "set_completeness": "Full Set"
    },
    "financials": {
      "agreed_price": 3400,
      "currency": "USD",
      "payment_method": "Wire"
    },
    "workflow_status": "intake_confirmed",
    "idempotency_key": "invoice_127_w3",
    "created_at": "2026-04-08T20:03:00Z"
  }
]
